case_id,message,mood
0001,"Not bad at all; somehow, anxiety fluttered for no clear reason. As the day wound down, cool evening lifted my energy, even if a few things wobbled.",slightly_positive
0002,"I woke up empty and stayed that way. I phone battery held up all day. On the way home, I meditation actually helped, and I’m struggling to find any spark.",very_sad
0003,"A nice rhythm set in early. Short version: better than yesterday. As the day wound down, stood in a long line for returns; later, steady rain hushed the street, and I’m proud of the effort.",happy
0004,"Better than I expected — wifi behaved all morning; forgot the one thing I needed; even if a few things wobbled.",slightly_positive
0005,"I’m disappointed in myself. Short version: mixed feelings. Later on, canceled a subscription I never used; later, the standup actually ended on time, and even simple tasks feel uphill.",sad
0006,"Hope feels out of reach right now. oddly, missed a call and feel bad. learned a neat trick in the editor, and it’s hard to believe this will lift.",very_sad
0007,"Everything feels dull and far away. I a quiet dinner at home. Meanwhile, I donated a bag of clothes, and I’m moving like I’m underwater.",very_sad
0008,"Loneliness crept in quietly; somehow, missed a deadline by a day. By evening, tinkered with a recipe and it flopped, and I keep second‑guessing every step.",sad
0009,"Everything aligned better than I hoped. if I’m honest, energy dipped mid‑afternoon. budget app shows I'm on track, and it feels like pure lift.",very_happy
0010,"I’m overwhelmed by a gray, sinking weight. Short version: mixed feelings. On the way home, a sudden storm changed plans; later, the window view calmed me down, and the future looks like fog on fog.",very_sad
0011,"I can’t see the point of anything today — the lecture clicked for once; a sudden storm changed plans; and it’s hard to believe this will lift.",very_sad
0012,"Hope feels out of reach right now. I I keep rereading the same page. Right after lunch, I found a small deal on essentials, and the future looks like fog on fog.",very_sad
0013,"Nothing stood out much; honestly, the connection felt like a marathon. By evening, learned a new chord progression, and the hours slipped by.",neutral
0014,"Kind of a mixed bag; for what it’s worth, I keep rereading the same page. First thing this morning, the forecast was kinder than expected, and I’m fine with that.",neutral
0015,"Quietly optimistic here. Short version: still here. Meanwhile, we planned a weekend picnic; later, tutorial cleared up a concept, nothing flashy, just steady steps.",slightly_positive
0016,"Feeling low and worn out — the window view calmed me down; the puzzle finally made sense; and I keep second‑guessing every step.",sad
0017,"Everything feels dull and far away. Short version: not great. First thing this morning, a bright, crisp morning; later, my plants perked up, and I’m struggling to find any spark.",very_sad
0018,"Loneliness crept in quietly. for once, computer fans roared under load. professor's feedback was constructive, and even simple tasks feel uphill.",sad
0019,"Mostly routine, start to finish — went for a short run; the lecture clicked for once; and I kept it simple.",neutral
0020,"Hope feels out of reach right now — tinkered with a recipe and it flopped; campus library was peaceful; and I’m moving like I’m underwater.",very_sad
0021,"Kind of a mixed bag — a sync error ate my changes; back pain flared up again; and I kept it simple.",neutral
0022,"Pretty decent flow today — voice notes were oddly helpful; tinkered with a recipe and it flopped; with room to grow tomorrow.",slightly_positive
0023,"Better than I expected — the forecast was kinder than expected; airport lines moved briskly; with room to grow tomorrow.",slightly_positive
0024,"Small annoyances piled up. I missed a question I knew. After that, I subway musicians brightened the commute, and I’m calling it early.",slightly_negative
0025,"A nice rhythm set in early. I sunlight poured across the desk. After that, I a sync error ate my changes, and I can breathe a little easier.",happy
0026,"Everything aligned better than I hoped. Short version: mixed feelings. Before noon, read a chapter that pulled me in; later, cooked a simple, decent meal, and I'm soaking it up.",very_happy
0027,"Feeling low and worn out. Short version: better than yesterday. After that, felt lonely even in a full house; later, rent cleared without issues, and I keep second‑guessing every step.",sad
0028,"Everything aligned better than I hoped; to be honest, felt lonely even in a full house. Meanwhile, trash day came too early, and the momentum is unreal.",very_happy
0029,"A nice rhythm set in early. for once, couldn't focus during the planning call. saved a little from this paycheck, and the pace felt just right.",happy
0030,"Today sparkled from the start; thankfully, computer fans roared under load. First thing this morning, found a small discount at checkout, and I want to bottle this feeling.",very_happy
0031,"Mostly routine, start to finish. Short version: still here. On the way home, the meeting could've been an email; later, shared a silly story that broke the tension, so I just kept moving.",neutral
0032,"I’m overwhelmed by a gray, sinking weight; in a small way, read a chapter that pulled me in. As the day wound down, forgot the one thing I needed, and I’m moving like I’m underwater.",very_sad
0033,"Nothing stood out much; surprisingly, the puzzle finally made sense. After that, woke up with a light headache, so I just kept moving.",neutral
0034,"I woke up empty and stayed that way. Short version: mixed feelings. On the way home, my workload feels lopsided; later, still nervous about rising costs, and it’s hard to believe this will lift.",very_sad
0035,"Loneliness crept in quietly; thankfully, I skipped lunch and felt off. First thing this morning, got a warm message this morning, and the day felt longer than it was.",sad
0036,"Pretty decent flow today; for once, campus library was peaceful. On the way home, cool evening lifted my energy, and I’ll take the progress.",slightly_positive
0037,"Better than I expected; in a small way, the meeting could've been an email. Meanwhile, still nervous about rising costs, nothing flashy, just steady steps.",slightly_positive
0038,"Mostly routine, start to finish; to be honest, a bright, crisp morning. Right after lunch, missed a call and feel bad, and I’m coasting a bit.",neutral
0039,"I’ll call this a small win. Short version: not great. Right after lunch, left the list at home again; later, the build succeeded on first try, nothing flashy, just steady steps.",slightly_positive
0040,"Good vibes carried me along — I kept mistyping commands; still nervous about rising costs; and I can breathe a little easier.",happy
0041,"My chest feels heavy today. Short version: progress. Right after lunch, read a chapter that pulled me in; later, phone battery held up all day, and I keep second‑guessing every step.",sad
0042,"Loneliness crept in quietly. Short version: better than yesterday. After that, my manager praised the draft; later, cleaned the kitchen top to bottom, and I keep second‑guessing every step.",sad
0043,"Pretty decent flow today. Short version: mixed feelings. By evening, felt lonely even in a full house; later, read a chapter that pulled me in, which feels good enough for now.",slightly_positive
0044,"I’ll call this a small win — calendar reminders saved me; donated a bag of clothes; nothing flashy, just steady steps.",slightly_positive
0045,"Small annoyances piled up — sketched late into the night; finals are creeping closer; but I managed to push through.",slightly_negative
0046,"Loneliness crept in quietly. I finally restocked basics. Right after lunch, I anxiety fluttered for no clear reason, and even simple tasks feel uphill.",sad
0047,"Feeling low and worn out — anxiety fluttered for no clear reason; presentation slides took longer than expected; and even simple tasks feel uphill.",sad
0048,"I woke up empty and stayed that way; for once, a sudden storm changed plans. First thing this morning, we planned a weekend picnic, and I’m tired down to the bones.",very_sad
0049,"Small annoyances piled up — we planned a weekend picnic; calendar reminders saved me; so I took more breaks than usual.",slightly_negative
0050,"I can’t see the point of anything today. Short version: not great. By evening, got a warm message this morning; later, the window view calmed me down, and I’m moving like I’m underwater.",very_sad
0051,"Everything aligned better than I hoped. I meditation actually helped. By evening, I organized the closet a bit, and I feel wildly grateful.",very_happy
0052,"I keep catching myself grinning for no reason. Short version: better than yesterday. Later on, the connection felt like a marathon; later, read a chapter that pulled me in, and it feels like pure lift.",very_happy
0053,"Hope feels out of reach right now — gray skies matched my mood; stood in a long line for returns; and I’m struggling to find any spark.",very_sad
0054,"Today sparkled from the start — the connection felt like a marathon; saved a little from this paycheck; and the momentum is unreal.",very_happy
0055,"I keep catching myself grinning for no reason. Short version: still here. Meanwhile, felt lonely even in a full house; later, study session ran too late, and I feel wildly grateful.",very_happy
0056,"I’m disappointed in myself; if I’m honest, woke up with a light headache. After that, my workload feels lopsided, and the day felt longer than it was.",sad
0057,"Mostly routine, start to finish — lost a tab group and sighed; worries about an older relative's health; and I kept it simple.",neutral
0058,"I’m overwhelmed by a gray, sinking weight. to be honest, couldn't focus during the planning call. finals are creeping closer, and I’m tired down to the bones.",very_sad
0059,"A bit off my game — shared a silly story that broke the tension; the meeting could've been an email; though it’s nothing catastrophic.",slightly_negative
0060,"Feeling grounded and content. I cleaned the kitchen top to bottom. First thing this morning, I professor's feedback was constructive, and I’m looking forward to tomorrow.",happy
0061,"I can't stop smiling — computer fans roared under load; traffic thinned out for once; and it feels like pure lift.",very_happy
0062,"I keep catching myself grinning for no reason. for what it’s worth, missed a call and feel bad. missed a deadline by a day, and I feel wildly grateful.",very_happy
0063,"Good vibes carried me along — a sync error ate my changes; sketched late into the night; and I can breathe a little easier.",happy
0064,"Pretty decent flow today — meditation actually helped; my workload feels lopsided; which feels good enough for now.",slightly_positive
0065,"Everything aligned better than I hoped. to be honest, found a small deal on essentials. couldn't focus during the planning call, and I feel wildly grateful.",very_happy
0066,"Nothing stood out much — splurged a bit and now second‑guessing; got a warm message this morning; and I’m fine with that.",neutral
0067,"Feeling grounded and content. somehow, left the list at home again. went for a short run, and I can breathe a little easier.",happy
0068,"I’m overwhelmed by a gray, sinking weight. if I’m honest, calendar reminders saved me. traffic thinned out for once, and I’m tired down to the bones.",very_sad
0069,"Everything feels dull and far away. I a sync error ate my changes. As the day wound down, I recorded a small win in my journal, and I’m struggling to find any spark.",very_sad
0070,"Everything aligned better than I hoped. I stood in a long line for returns. Later on, I phone battery held up all day, and the momentum is unreal.",very_happy
0071,"Feeling grounded and content. Short version: not great. After that, laundry took less time than feared; later, subway musicians brightened the commute, and I’m ending on a high note.",happy
0072,"I’m disappointed in myself; honestly, subway musicians brightened the commute. By evening, the meeting could've been an email, and I can’t shake this fog yet.",sad
0073,"Hope feels out of reach right now; in a small way, slept better than usual. Meanwhile, submitted the assignment early, and I’m struggling to find any spark.",very_sad
0074,"Kind of a mixed bag — a detour added twenty minutes; my workload feels lopsided; and I kept it simple.",neutral
0075,"Everything feels dull and far away; for what it’s worth, a sudden storm changed plans. On the way home, airport lines moved briskly, and I’m tired down to the bones.",very_sad
0076,"Kind of a mixed bag — shared a silly story that broke the tension; calendar reminders saved me; and I kept it simple.",neutral
0077,"I woke up empty and stayed that way — airport lines moved briskly; calendar reminders saved me; and it’s hard to believe this will lift.",very_sad
0078,"Everything feels dull and far away. I we planned a weekend picnic. Meanwhile, I groceries cost more than expected, and the future looks like fog on fog.",very_sad
0079,"Feeling low and worn out. I woke up with a light headache. Meanwhile, I finals are creeping closer, and the day felt longer than it was.",sad
0080,"I’ll call this a small win. Short version: mixed feelings. After that, the meeting could've been an email; later, humid air made chores sluggish, and I’ll take the progress.",slightly_positive
0081,"Hope feels out of reach right now. Short version: still here. After that, anxiety fluttered for no clear reason; later, recorded a small win in my journal, and it’s hard to believe this will lift.",very_sad
0082,"I keep catching myself grinning for no reason. Short version: not great. Right after lunch, a bright, crisp morning; later, budget app shows I'm on track, and the momentum is unreal.",very_happy
0083,"I keep catching myself grinning for no reason. I couldn't focus during the planning call. Right after lunch, I sketched late into the night, and it feels like pure lift.",very_happy
0084,"Better than I expected. I paid a bill before it was due. By evening, I the forecast was kinder than expected, and I’ll take the progress.",slightly_positive
0085,"My heart feels light and loud in the best way. in a small way, subway musicians brightened the commute. my workload feels lopsided, and the momentum is unreal.",very_happy
0086,"I can't stop smiling. Short version: still here. Later on, back pain flared up again; later, canceled a subscription I never used, and I want to bottle this feeling.",very_happy
0087,"I’ll call this a small win. Short version: better than yesterday. Before noon, my workload feels lopsided; later, still nervous about rising costs, even if a few things wobbled.",slightly_positive
0088,"Nothing stood out much; surprisingly, back pain flared up again. Before noon, the window view calmed me down, and I’m fine with that.",neutral
0089,"Better than I expected — the seat was wobbly and annoying; back pain flared up again; and I’ll take the progress.",slightly_positive
0090,"Hope feels out of reach right now. unfortunately, the forecast was kinder than expected. the window view calmed me down, and I’m moving like I’m underwater.",very_sad
0091,"A bit off my game; unfortunately, the connection felt like a marathon. Right after lunch, I keep rereading the same page, though it’s nothing catastrophic.",slightly_negative
0092,"Small annoyances piled up — stood in a long line for returns; slept better than usual; but tomorrow is another shot.",slightly_negative
0093,"Tired and easily distracted. Short version: mixed feelings. First thing this morning, missed a call and feel bad; later, back pain flared up again, but tomorrow is another shot.",slightly_negative
0094,"Today sparkled from the start. Short version: not great. After that, found a small discount at checkout; later, the connection felt like a marathon, and it feels like pure lift.",very_happy
0095,"Mildly frustrated; oddly, video-chatted with relatives. Meanwhile, calendar reminders saved me, but I managed to push through.",slightly_negative
0096,"Kind of a mixed bag. surprisingly, humid air made chores sluggish. a quiet dinner at home, and I’m fine with that.",neutral
0097,"Average day, average energy; oddly, recorded a small win in my journal. First thing this morning, couldn't focus during the planning call, so I just kept moving.",neutral
0098,"Mildly frustrated. Short version: mixed feelings. By evening, learned a neat trick in the editor; later, lost a tab group and sighed, but I managed to push through.",slightly_negative
0099,"My chest feels heavy today. I presentation slides took longer than expected. As the day wound down, I lost a tab group and sighed, and I can’t shake this fog yet.",sad
0100,"Everything aligned better than I hoped; thankfully, anxiety fluttered for no clear reason. Right after lunch, organized the closet a bit, and it feels like pure lift.",very_happy
0101,"My chest feels heavy today; thankfully, the puzzle finally made sense. Later on, sticky heat lingered all day, and even simple tasks feel uphill.",sad
0102,"A nice rhythm set in early. I submitted the assignment early. Meanwhile, I a sudden storm changed plans, and the pace felt just right.",happy
0103,"I’m dragging my feet on everything. I submitted the assignment early. Meanwhile, I the window view calmed me down, and I can’t shake this fog yet.",sad
0104,"It was an ordinary blur. I meditation actually helped. Meanwhile, I the train arrived right as I reached the platform, and I’m coasting a bit.",neutral
0105,"Kind of a mixed bag. I my plants perked up. By evening, I merged a tricky pull request, so I just kept moving.",neutral
0106,"I keep catching myself grinning for no reason; honestly, trash day came too early. After that, doctor's advice was reassuring, and it feels like pure lift.",very_happy
0107,"I woke up empty and stayed that way. Short version: better than yesterday. On the way home, wifi behaved all morning; later, baked bread that actually rose, and it’s hard to believe this will lift.",very_sad
0108,"Hope feels out of reach right now — cleaned the kitchen top to bottom; sunlight poured across the desk; and the future looks like fog on fog.",very_sad
0109,"I kept losing my train of thought. I lost a tab group and sighed. By evening, I wind rattled the windows, so I took more breaks than usual.",slightly_negative
0110,"Feeling grounded and content — professor's feedback was constructive; stood in a long line for returns; and I can breathe a little easier.",happy
0111,"Tired and easily distracted. I aced a quiz after cramming. Later on, I found a small deal on essentials, though it’s nothing catastrophic.",slightly_negative
0112,"A nice rhythm set in early; in a small way, submitted the assignment early. Right after lunch, worries about an older relative's health, and I’m looking forward to tomorrow.",happy
0113,"Mildly frustrated. for once, interview prep is dragging. campus library was peaceful, but tomorrow is another shot.",slightly_negative
0114,"I can't stop smiling. I my workload feels lopsided. As the day wound down, I splurged a bit and now second‑guessing, and the momentum is unreal.",very_happy
0115,"Hope feels out of reach right now; somehow, wind rattled the windows. After that, helped a sibling with homework, and I’m moving like I’m underwater.",very_sad
0116,"I'm pleasantly surprised by the day — helped a sibling with homework; a sudden storm changed plans; and the pace felt just right.",happy
0117,"A bit off my game — anxiety fluttered for no clear reason; the seat was wobbly and annoying; so I took more breaks than usual.",slightly_negative
0118,"My heart feels light and loud in the best way. somehow, interview prep is dragging. sticky heat lingered all day, and it feels like pure lift.",very_happy
0119,"I’ll call this a small win. I found a small deal on essentials. On the way home, I missed a call and feel bad, and I’ll take the progress.",slightly_positive
0120,"I kept losing my train of thought — a bright, crisp morning; the puzzle finally made sense; and I’m calling it early.",slightly_negative
0121,"A bit off my game. Short version: progress. After that, steady rain hushed the street; later, recorded a small win in my journal, but tomorrow is another shot.",slightly_negative
0122,"Mildly frustrated. I the connection felt like a marathon. First thing this morning, I meditation actually helped, so I took more breaks than usual.",slightly_negative
0123,"Better than I expected. Short version: not great. First thing this morning, unexpected fee threw me off; later, went for a short run, which feels good enough for now.",slightly_positive
0124,"Mostly routine, start to finish. Short version: better than yesterday. On the way home, organized the closet a bit; later, the forecast was kinder than expected, and the hours slipped by.",neutral
0125,"Things went smoothly overall — lab report is due tomorrow; cleaned the kitchen top to bottom; and I’m looking forward to tomorrow.",happy
0126,"Small annoyances piled up. Short version: better than yesterday. As the day wound down, sunlight poured across the desk; later, the lecture clicked for once, and I’m calling it early.",slightly_negative
0127,"Better than I expected. I donated a bag of clothes. As the day wound down, I energy dipped mid‑afternoon, which feels good enough for now.",slightly_positive
0128,"Quietly optimistic here. I the puzzle finally made sense. Later on, I the standup actually ended on time, which feels good enough for now.",slightly_positive
0129,"I’m overwhelmed by a gray, sinking weight. somehow, read a chapter that pulled me in. found a small discount at checkout, and I’m tired down to the bones.",very_sad
0130,"Quietly optimistic here; thankfully, study session ran too late. Meanwhile, the connection felt like a marathon, even if a few things wobbled.",slightly_positive
0131,"Today sparkled from the start. Short version: still here. After that, couldn't focus during the planning call; later, baked bread that actually rose, and I feel wildly grateful.",very_happy
0132,"Things went smoothly overall. I sketched late into the night. After that, I voice notes were oddly helpful, and the pace felt just right.",happy
0133,"Kind of a mixed bag. for once, sunlight poured across the desk. trash day came too early, so I just kept moving.",neutral
0134,"It was an ordinary blur. I a bug fix finally shipped. As the day wound down, I meditation actually helped, and the hours slipped by.",neutral
0135,"Everything feels dull and far away. Short version: mixed feelings. First thing this morning, my plants perked up; later, donated a bag of clothes, and I’m moving like I’m underwater.",very_sad
0136,"I’m dragging my feet on everything. unfortunately, trash day came too early. a sudden storm changed plans, and I can’t shake this fog yet.",sad
0137,"I’m dragging my feet on everything — found a small deal on essentials; felt lonely even in a full house; and I can’t shake this fog yet.",sad
0138,"Kind of a mixed bag. for what it’s worth, professor's feedback was constructive. woke up with a light headache, and I’m coasting a bit.",neutral
0139,"I woke up empty and stayed that way. I sticky heat lingered all day. As the day wound down, I shared a silly story that broke the tension, and it’s hard to believe this will lift.",very_sad
0140,"I’m overwhelmed by a gray, sinking weight. Short version: progress. First thing this morning, voice notes were oddly helpful; later, helped a sibling with homework, and it’s hard to believe this will lift.",very_sad
0141,"I’m overwhelmed by a gray, sinking weight. in a small way, the puzzle finally made sense. my manager praised the draft, and the future looks like fog on fog.",very_sad
0142,"My heart feels light and loud in the best way. I a sudden storm changed plans. Meanwhile, I the connection felt like a marathon, and I feel wildly grateful.",very_happy
0143,"I kept losing my train of thought. Short version: not great. First thing this morning, unexpected fee threw me off; later, a bug fix finally shipped, though it’s nothing catastrophic.",slightly_negative
0144,"Everything feels dull and far away. Short version: progress. On the way home, a sync error ate my changes; later, trash day came too early, and I’m moving like I’m underwater.",very_sad
0145,"Everything feels dull and far away. thankfully, traffic thinned out for once. lost a tab group and sighed, and it’s hard to believe this will lift.",very_sad
0146,"Good vibes carried me along. Short version: not great. On the way home, groceries cost more than expected; later, the puzzle finally made sense, and I can breathe a little easier.",happy
0147,"Mildly frustrated — we planned a weekend picnic; left the list at home again; but tomorrow is another shot.",slightly_negative
0148,"Small annoyances piled up. Short version: progress. By evening, stood in a long line for returns; later, the build succeeded on first try, though it’s nothing catastrophic.",slightly_negative
0149,"My chest feels heavy today — video-chatted with relatives; a bright, crisp morning; and even simple tasks feel uphill.",sad
0150,"A nice rhythm set in early. oddly, I skipped lunch and felt off. wind rattled the windows, and I’m proud of the effort.",happy
0151,"I kept losing my train of thought. unfortunately, missed a bus by seconds. submitted the assignment early, though it’s nothing catastrophic.",slightly_negative
0152,"Tired and easily distracted. if I’m honest, baked bread that actually rose. presentation slides took longer than expected, though it’s nothing catastrophic.",slightly_negative
