case_id,message,mood
0930,"Everything aligned better than I hoped. in a small way, the standup actually ended on time. campus library was peaceful, and it feels like pure lift.",very_happy
0931,"I kept losing my train of thought. oddly, missed a deadline by a day. slept better than usual, though it’s nothing catastrophic.",slightly_negative
0932,"I'm pleasantly surprised by the day. I missed a call and feel bad. As the day wound down, I subway musicians brightened the commute, and I’m looking forward to tomorrow.",happy
0933,"Things went smoothly overall. I lab report is due tomorrow. Before noon, I wrapped up a sprint review, and I can breathe a little easier.",happy
0934,"I’m disappointed in myself; for what it’s worth, left the list at home again. Right after lunch, I kept mistyping commands, and I miss how easy things used to feel.",sad
0935,"A bit off my game — computer fans roared under load; splurged a bit and now second‑guessing; so I took more breaks than usual.",slightly_negative
0936,"It was an ordinary blur — the forecast was kinder than expected; we planned a weekend picnic; and I’m coasting a bit.",neutral
0937,"Mostly routine, start to finish. unfortunately, trash day came too early. phone battery held up all day, and I kept it simple.",neutral
0938,"Good vibes carried me along. if I’m honest, the standup actually ended on time. meditation actually helped, and I’m looking forward to tomorrow.",happy
0939,"I’m disappointed in myself. I tutorial cleared up a concept. After that, I baked bread that actually rose, and I miss how easy things used to feel.",sad
0940,"Pretty decent flow today. I groceries cost more than expected. Later on, I my workload feels lopsided, which feels good enough for now.",slightly_positive
0941,"Mildly frustrated. Short version: mixed feelings. By evening, I kept mistyping commands; later, found a small discount at checkout, but tomorrow is another shot.",slightly_negative
0942,"Quietly optimistic here. Short version: better than yesterday. On the way home, finally restocked basics; later, group project is chaotic, which feels good enough for now.",slightly_positive
0943,"Today sparkled from the start. I donated a bag of clothes. As the day wound down, I sticky heat lingered all day, and it feels like pure lift.",very_happy
0944,"Everything aligned better than I hoped. I shared a silly story that broke the tension. On the way home, I trash day came too early, and I'm soaking it up.",very_happy
0945,"I woke up empty and stayed that way — donated a bag of clothes; wind rattled the windows; and I’m moving like I’m underwater.",very_sad
0946,"I'm pleasantly surprised by the day — rent cleared without issues; humid air made chores sluggish; and I’m ending on a high note.",happy
0947,"Not bad at all; for once, the lecture clicked for once. Meanwhile, left the list at home again, and I’ll take the progress.",slightly_positive
0948,"Feeling grounded and content. for what it’s worth, found a small discount at checkout. wifi behaved all morning, and I’m looking forward to tomorrow.",happy
0949,"Mildly frustrated. surprisingly, a sync error ate my changes. forgot the one thing I needed, but tomorrow is another shot.",slightly_negative
0950,"I keep catching myself grinning for no reason. I app update fixed a nagging bug. First thing this morning, I tinkered with a recipe and it flopped, and I'm soaking it up.",very_happy
0951,"Quietly optimistic here; in a small way, phone battery held up all day. On the way home, woke up with a light headache, and I’ll take the progress.",slightly_positive
0952,"Hope feels out of reach right now. Short version: progress. Before noon, a sudden storm changed plans; later, took a long walk instead of rideshare, and I’m struggling to find any spark.",very_sad
0953,"Hope feels out of reach right now. I found a small discount at checkout. Right after lunch, I found a small deal on essentials, and it’s hard to believe this will lift.",very_sad
0954,"I can’t see the point of anything today; to be honest, budget app shows I'm on track. On the way home, voice notes were oddly helpful, and the future looks like fog on fog.",very_sad
0955,"I’m disappointed in myself. I cleaned the kitchen top to bottom. On the way home, I a detour added twenty minutes, and I can’t shake this fog yet.",sad
0956,"Loneliness crept in quietly. Short version: better than yesterday. Later on, sunlight poured across the desk; later, baked bread that actually rose, and the day felt longer than it was.",sad
0957,"It was an ordinary blur. I a quiet dinner at home. By evening, I cool evening lifted my energy, and I kept it simple.",neutral
0958,"I’m disappointed in myself — the window view calmed me down; a bright, crisp morning; and the day felt longer than it was.",sad
0959,"Today sparkled from the start; unfortunately, tutorial cleared up a concept. Right after lunch, the connection felt like a marathon, and I feel wildly grateful.",very_happy
0960,"Hope feels out of reach right now. for what it’s worth, baked bread that actually rose. back pain flared up again, and I’m struggling to find any spark.",very_sad
0961,"Pretty decent flow today; oddly, half‑finished a watercolor. By evening, couldn't focus during the planning call, which feels good enough for now.",slightly_positive
0962,"Kind of a mixed bag. honestly, the forecast was kinder than expected. the connection felt like a marathon, and I’m coasting a bit.",neutral
0963,"Pretty decent flow today; unfortunately, a quiet dinner at home. As the day wound down, aced a quiz after cramming, and I’ll take the progress.",slightly_positive
0964,"I’ll call this a small win — energy dipped mid‑afternoon; my workload feels lopsided; even if a few things wobbled.",slightly_positive
0965,"A bit off my game. I groceries cost more than expected. As the day wound down, I airport lines moved briskly, but tomorrow is another shot.",slightly_negative
0966,"Kind of a mixed bag; surprisingly, woke up with a light headache. First thing this morning, unexpected fee threw me off, so I just kept moving.",neutral
0967,"Today sparkled from the start. if I’m honest, app update fixed a nagging bug. felt lonely even in a full house, and I feel wildly grateful.",very_happy
0968,"My heart feels light and loud in the best way; for once, a bug fix finally shipped. Before noon, paid a bill before it was due, and I'm soaking it up.",very_happy
0969,"Quietly optimistic here. surprisingly, my workload feels lopsided. the forecast was kinder than expected, and I’ll take the progress.",slightly_positive
0970,"Feeling low and worn out — subway musicians brightened the commute; my workload feels lopsided; and I miss how easy things used to feel.",sad
0971,"Quietly optimistic here; for what it’s worth, splurged a bit and now second‑guessing. Meanwhile, my plants perked up, even if a few things wobbled.",slightly_positive
0972,"Feeling grounded and content. for once, a bug fix finally shipped. practice felt stale today, and I’m proud of the effort.",happy
0973,"Nothing stood out much; if I’m honest, worries about an older relative's health. Later on, canceled a subscription I never used, and I’m coasting a bit.",neutral
0974,"Small annoyances piled up. I the build succeeded on first try. On the way home, I missed a call and feel bad, but tomorrow is another shot.",slightly_negative
0975,"Not bad at all; for what it’s worth, still nervous about rising costs. Later on, doctor's advice was reassuring, even if a few things wobbled.",slightly_positive
0976,"Everything feels dull and far away — left the list at home again; I skipped lunch and felt off; and I’m struggling to find any spark.",very_sad
0977,"Mildly frustrated. Short version: mixed feelings. Right after lunch, subway musicians brightened the commute; later, went for a short run, and I’m calling it early.",slightly_negative
0978,"Everything feels dull and far away. if I’m honest, the build succeeded on first try. the puzzle finally made sense, and the future looks like fog on fog.",very_sad
0979,"I can’t see the point of anything today; for what it’s worth, wifi behaved all morning. By evening, stood in a long line for returns, and I’m moving like I’m underwater.",very_sad
0980,"Feeling grounded and content. Short version: progress. As the day wound down, left the list at home again; later, presentation slides took longer than expected, and the pace felt just right.",happy
0981,"I keep catching myself grinning for no reason. I got a warm message this morning. By evening, I airport lines moved briskly, and I want to bottle this feeling.",very_happy
0982,"Kind of a mixed bag. to be honest, small argument over chores. merged a tricky pull request, and the hours slipped by.",neutral
0983,"Things went smoothly overall; thankfully, computer fans roared under load. As the day wound down, found a small deal on essentials, and I’m proud of the effort.",happy
0984,"A bit off my game — video-chatted with relatives; cooked a simple, decent meal; though it’s nothing catastrophic.",slightly_negative
0985,"Things went smoothly overall — video-chatted with relatives; saved a little from this paycheck; and I’m looking forward to tomorrow.",happy
0986,"I’ll call this a small win. Short version: mixed feelings. Right after lunch, cleaned the kitchen top to bottom; later, baked bread that actually rose, nothing flashy, just steady steps.",slightly_positive
0987,"Things went smoothly overall; for what it’s worth, learned a new chord progression. By evening, interview prep is dragging, and I’m proud of the effort.",happy
0988,"Small annoyances piled up. in a small way, lost a tab group and sighed. tutorial cleared up a concept, but tomorrow is another shot.",slightly_negative
0989,"I’m dragging my feet on everything. I meditation actually helped. First thing this morning, I my plants perked up, and the day felt longer than it was.",sad
0990,"Good vibes carried me along. I wind rattled the windows. First thing this morning, I the puzzle finally made sense, and the pace felt just right.",happy
0991,"Kind of a mixed bag. I felt lonely even in a full house. By evening, I I skipped lunch and felt off, and I’m coasting a bit.",neutral
0992,"It was an ordinary blur. I felt lonely even in a full house. Right after lunch, I humid air made chores sluggish, and I kept it simple.",neutral
0993,"My chest feels heavy today. for once, missed a bus by seconds. the forecast was kinder than expected, and I can’t shake this fog yet.",sad
0994,"Not bad at all — steady rain hushed the street; wrapped up a sprint review; and I’ll take the progress.",slightly_positive
0995,"I’ll call this a small win. I video-chatted with relatives. Before noon, I the standup actually ended on time, nothing flashy, just steady steps.",slightly_positive
0996,"I'm pleasantly surprised by the day; for what it’s worth, took a long walk instead of rideshare. Before noon, found a small deal on essentials, and the pace felt just right.",happy
0997,"Not bad at all — calendar reminders saved me; groceries cost more than expected; even if a few things wobbled.",slightly_positive
0998,"I can't stop smiling. to be honest, submitted the assignment early. phone battery held up all day, and I feel wildly grateful.",very_happy
0999,"I’m overwhelmed by a gray, sinking weight. oddly, gray skies matched my mood. helped a sibling with homework, and the future looks like fog on fog.",very_sad
1000,"I’m disappointed in myself; if I’m honest, we planned a weekend picnic. On the way home, the lecture clicked for once, and I miss how easy things used to feel.",sad
1001,"My chest feels heavy today — learned a new chord progression; finals are creeping closer; and even simple tasks feel uphill.",sad
1002,"Quietly optimistic here; thankfully, forgot the one thing I needed. On the way home, small argument over chores, with room to grow tomorrow.",slightly_positive
1003,"I can't stop smiling — canceled a subscription I never used; a detour added twenty minutes; and I'm soaking it up.",very_happy
1004,"It was an ordinary blur — worries about an older relative's health; cool evening lifted my energy; and I’m fine with that.",neutral
1005,"Today sparkled from the start. unfortunately, missed a call and feel bad. group project is chaotic, and I want to bottle this feeling.",very_happy
1006,"Hope feels out of reach right now. oddly, a sudden storm changed plans. the seat was wobbly and annoying, and it’s hard to believe this will lift.",very_sad
1007,"I keep catching myself grinning for no reason. I cool evening lifted my energy. As the day wound down, I calendar reminders saved me, and I want to bottle this feeling.",very_happy
1008,"I woke up empty and stayed that way; for once, sticky heat lingered all day. Before noon, study session ran too late, and I’m tired down to the bones.",very_sad
1009,"Feeling low and worn out. I slept better than usual. First thing this morning, I my plants perked up, and I miss how easy things used to feel.",sad
1010,"I’m overwhelmed by a gray, sinking weight. Short version: not great. After that, I keep rereading the same page; later, interview prep is dragging, and I’m moving like I’m underwater.",very_sad
1011,"Today sparkled from the start; for what it’s worth, back pain flared up again. Right after lunch, finally restocked basics, and I'm soaking it up.",very_happy
1012,"I’m dragging my feet on everything; somehow, sunlight poured across the desk. After that, baked bread that actually rose, and I can’t shake this fog yet.",sad
1013,"Pretty decent flow today. I small argument over chores. Right after lunch, I baked bread that actually rose, even if a few things wobbled.",slightly_positive
1014,"Nothing stood out much. honestly, small argument over chores. subway musicians brightened the commute, so I just kept moving.",neutral
1015,"Not bad at all. Short version: still here. After that, the standup actually ended on time; later, paid a bill before it was due, even if a few things wobbled.",slightly_positive
1016,"I’ll call this a small win — my workload feels lopsided; cool evening lifted my energy; nothing flashy, just steady steps.",slightly_positive
1017,"Feeling low and worn out. I went for a short run. After that, I a bright, crisp morning, and I keep second‑guessing every step.",sad
1018,"My chest feels heavy today. for once, humid air made chores sluggish. my workload feels lopsided, and I keep second‑guessing every step.",sad
1019,"I’m overwhelmed by a gray, sinking weight. I airport lines moved briskly. Right after lunch, I sketched late into the night, and I’m struggling to find any spark.",very_sad
1020,"Hope feels out of reach right now. I groceries cost more than expected. Meanwhile, I the lecture clicked for once, and I’m tired down to the bones.",very_sad
1021,"I can't stop smiling — rent cleared without issues; a quiet dinner at home; and I feel wildly grateful.",very_happy
1022,"Pretty decent flow today. Short version: not great. Meanwhile, back pain flared up again; later, wifi behaved all morning, nothing flashy, just steady steps.",slightly_positive
1023,"Everything aligned better than I hoped. unfortunately, interview prep is dragging. laundry took less time than feared, and I'm soaking it up.",very_happy
1024,"Hope feels out of reach right now — the build succeeded on first try; doctor's advice was reassuring; and it’s hard to believe this will lift.",very_sad
1025,"I’m overwhelmed by a gray, sinking weight. for once, steady rain hushed the street. calendar reminders saved me, and I’m struggling to find any spark.",very_sad
1026,"Pretty decent flow today. I found a small deal on essentials. Later on, I my manager praised the draft, which feels good enough for now.",slightly_positive
1027,"A nice rhythm set in early — went for a short run; got a warm message this morning; and I’m looking forward to tomorrow.",happy
1028,"Everything aligned better than I hoped. honestly, the window view calmed me down. helped a sibling with homework, and the momentum is unreal.",very_happy
1029,"Not bad at all; for once, anxiety fluttered for no clear reason. First thing this morning, trash day came too early, and I’ll take the progress.",slightly_positive
1030,"It was an ordinary blur — missed a deadline by a day; got a warm message this morning; so I just kept moving.",neutral
1031,"Nothing stood out much; unfortunately, small argument over chores. On the way home, groceries cost more than expected, and the hours slipped by.",neutral
1032,"Small annoyances piled up. I study session ran too late. First thing this morning, I worries about an older relative's health, so I took more breaks than usual.",slightly_negative
1033,"Everything aligned better than I hoped. honestly, aced a quiz after cramming. the window view calmed me down, and I want to bottle this feeling.",very_happy
1034,"I'm pleasantly surprised by the day. Short version: not great. Right after lunch, recorded a small win in my journal; later, the build succeeded on first try, and I’m ending on a high note.",happy
1035,"I can't stop smiling. I still nervous about rising costs. Meanwhile, I couldn't focus during the planning call, and I feel wildly grateful.",very_happy
1036,"A nice rhythm set in early. if I’m honest, submitted the assignment early. paid a bill before it was due, and the pace felt just right.",happy
1037,"Feeling grounded and content; somehow, the window view calmed me down. Later on, missed a question I knew, and I’m looking forward to tomorrow.",happy
1038,"Things went smoothly overall — shared a silly story that broke the tension; submitted the assignment early; and the pace felt just right.",happy
1039,"I can't stop smiling. Short version: still here. Meanwhile, my plants perked up; later, the connection felt like a marathon, and it feels like pure lift.",very_happy
1040,"I’m dragging my feet on everything; for once, traffic thinned out for once. Right after lunch, missed a call and feel bad, and I can’t shake this fog yet.",sad
1041,"Everything feels dull and far away — the puzzle finally made sense; humid air made chores sluggish; and it’s hard to believe this will lift.",very_sad
1042,"Good vibes carried me along — groceries cost more than expected; small argument over chores; and I’m proud of the effort.",happy
1043,"Everything aligned better than I hoped. to be honest, subway musicians brightened the commute. humid air made chores sluggish, and I feel wildly grateful.",very_happy
1044,"Everything aligned better than I hoped. Short version: still here. First thing this morning, half‑finished a watercolor; later, saved a little from this paycheck, and I want to bottle this feeling.",very_happy
1045,"Feeling low and worn out; for once, sticky heat lingered all day. Before noon, sketched late into the night, and I keep second‑guessing every step.",sad
1046,"It was an ordinary blur. somehow, cleaned the kitchen top to bottom. missed a call and feel bad, and I kept it simple.",neutral
1047,"I’ll call this a small win. somehow, sketched late into the night. professor's feedback was constructive, even if a few things wobbled.",slightly_positive
1048,"I’m overwhelmed by a gray, sinking weight. Short version: not great. After that, finally restocked basics; later, lab report is due tomorrow, and the future looks like fog on fog.",very_sad
1049,"Average day, average energy; unfortunately, back pain flared up again. On the way home, my plants perked up, and I’m fine with that.",neutral
1050,"Tired and easily distracted — rent cleared without issues; laundry took less time than feared; so I took more breaks than usual.",slightly_negative
1051,"I'm pleasantly surprised by the day. for what it’s worth, sketched late into the night. calendar reminders saved me, and I’m ending on a high note.",happy
1052,"Pretty decent flow today — tinkered with a recipe and it flopped; felt lonely even in a full house; with room to grow tomorrow.",slightly_positive
1053,"I can't stop smiling. Short version: not great. Meanwhile, sticky heat lingered all day; later, groceries cost more than expected, and I'm soaking it up.",very_happy
1054,"I’m dragging my feet on everything. Short version: better than yesterday. First thing this morning, study session ran too late; later, the seat was wobbly and annoying, and I can’t shake this fog yet.",sad
1055,"Today sparkled from the start; in a small way, my workload feels lopsided. Right after lunch, saved a little from this paycheck, and I want to bottle this feeling.",very_happy
1056,"Loneliness crept in quietly; oddly, woke up with a light headache. Right after lunch, the window view calmed me down, and the day felt longer than it was.",sad
1057,"Hope feels out of reach right now. I tinkered with a recipe and it flopped. Right after lunch, I meditation actually helped, and I’m moving like I’m underwater.",very_sad
1058,"Good vibes carried me along. Short version: mixed feelings. As the day wound down, wrapped up a sprint review; later, sunlight poured across the desk, and I can breathe a little easier.",happy
1059,"Today sparkled from the start. Short version: not great. Before noon, recorded a small win in my journal; later, shared a silly story that broke the tension, and the momentum is unreal.",very_happy
1060,"Today sparkled from the start. I my manager praised the draft. As the day wound down, I a sudden storm changed plans, and I want to bottle this feeling.",very_happy
1061,"Average day, average energy — steady rain hushed the street; went for a short run; and I’m fine with that.",neutral
1062,"Not bad at all; to be honest, the build succeeded on first try. Right after lunch, we planned a weekend picnic, even if a few things wobbled.",slightly_positive
1063,"I keep catching myself grinning for no reason; for once, finally restocked basics. Right after lunch, felt lonely even in a full house, and I'm soaking it up.",very_happy
1064,"Today sparkled from the start. Short version: still here. Before noon, missed a call and feel bad; later, took a long walk instead of rideshare, and I feel wildly grateful.",very_happy
1065,"It was an ordinary blur. Short version: progress. Meanwhile, sunlight poured across the desk; later, unexpected fee threw me off, and I kept it simple.",neutral
1066,"Good vibes carried me along. I finals are creeping closer. By evening, I missed a bus by seconds, and I can breathe a little easier.",happy
1067,"Today sparkled from the start; if I’m honest, missed a question I knew. First thing this morning, cleaned the kitchen top to bottom, and I want to bottle this feeling.",very_happy
1068,"Good vibes carried me along. oddly, cool evening lifted my energy. tutorial cleared up a concept, and I can breathe a little easier.",happy
1069,"Hope feels out of reach right now; for what it’s worth, half‑finished a watercolor. Meanwhile, took a long walk instead of rideshare, and I’m struggling to find any spark.",very_sad
1070,"Average day, average energy. Short version: mixed feelings. After that, the puzzle finally made sense; later, trash day came too early, and the hours slipped by.",neutral
1071,"Average day, average energy. I finals are creeping closer. As the day wound down, I slept better than usual, and I’m fine with that.",neutral
1072,"It was an ordinary blur; for what it’s worth, woke up with a light headache. Before noon, my plants perked up, and I’m coasting a bit.",neutral
1073,"Pretty decent flow today — helped a sibling with homework; found a small discount at checkout; even if a few things wobbled.",slightly_positive
1074,"Tired and easily distracted. I airport lines moved briskly. After that, I organized the closet a bit, and I’m calling it early.",slightly_negative
1075,"I can’t see the point of anything today. for what it’s worth, groceries cost more than expected. sticky heat lingered all day, and I’m moving like I’m underwater.",very_sad
1076,"Small annoyances piled up. Short version: not great. Later on, a sudden storm changed plans; later, the seat was wobbly and annoying, though it’s nothing catastrophic.",slightly_negative
1077,"Small annoyances piled up; somehow, sticky heat lingered all day. After that, energy dipped mid‑afternoon, but I managed to push through.",slightly_negative
1078,"Quietly optimistic here — I kept mistyping commands; splurged a bit and now second‑guessing; with room to grow tomorrow.",slightly_positive
1079,"Everything aligned better than I hoped. I steady rain hushed the street. On the way home, I my manager praised the draft, and I want to bottle this feeling.",very_happy
1080,"Hope feels out of reach right now; unfortunately, tutorial cleared up a concept. Later on, energy dipped mid‑afternoon, and it’s hard to believe this will lift.",very_sad
1081,"Feeling grounded and content. Short version: progress. Before noon, read a chapter that pulled me in; later, a bug fix finally shipped, and I’m looking forward to tomorrow.",happy
1082,"I keep catching myself grinning for no reason — sticky heat lingered all day; saved a little from this paycheck; and I feel wildly grateful.",very_happy
1083,"My heart feels light and loud in the best way. I trash day came too early. On the way home, I tutorial cleared up a concept, and I want to bottle this feeling.",very_happy
1084,"Feeling low and worn out; honestly, I skipped lunch and felt off. Later on, the meeting could've been an email, and I miss how easy things used to feel.",sad
1085,"I’m dragging my feet on everything — the seat was wobbly and annoying; missed a call and feel bad; and the day felt longer than it was.",sad
