case_id,message,mood
1401,"Nothing stood out much. I budget app shows I'm on track. Meanwhile, I learned a new chord progression, and I’m fine with that.",neutral
1402,"I’ll call this a small win; for what it’s worth, the forecast was kinder than expected. After that, my workload feels lopsided, with room to grow tomorrow.",slightly_positive
1403,"Feeling grounded and content. if I’m honest, a bug fix finally shipped. baked bread that actually rose, and I’m ending on a high note.",happy
1404,"I kept losing my train of thought. thankfully, cool evening lifted my energy. phone battery held up all day, but I managed to push through.",slightly_negative
1405,"Nothing stood out much. oddly, canceled a subscription I never used. got a warm message this morning, and the hours slipped by.",neutral
1406,"Average day, average energy; for what it’s worth, took a long walk instead of rideshare. Before noon, back pain flared up again, and I kept it simple.",neutral
1407,"I can't stop smiling. I professor's feedback was constructive. By evening, I sticky heat lingered all day, and I feel wildly grateful.",very_happy
1408,"I kept losing my train of thought. I found a small discount at checkout. By evening, I recorded a small win in my journal, but tomorrow is another shot.",slightly_negative
1409,"I’m dragging my feet on everything. I read a chapter that pulled me in. Meanwhile, I wind rattled the windows, and I can’t shake this fog yet.",sad
1410,"Good vibes carried me along — small argument over chores; couldn't focus during the planning call; and I can breathe a little easier.",happy
1411,"My chest feels heavy today. I the meeting could've been an email. First thing this morning, I the window view calmed me down, and I keep second‑guessing every step.",sad
1412,"Feeling low and worn out — subway musicians brightened the commute; found a small discount at checkout; and I miss how easy things used to feel.",sad
1413,"I woke up empty and stayed that way — practice felt stale today; missed a call and feel bad; and I’m tired down to the bones.",very_sad
1414,"Tired and easily distracted; in a small way, a sync error ate my changes. After that, canceled a subscription I never used, but I managed to push through.",slightly_negative
1415,"Average day, average energy — woke up with a light headache; missed a bus by seconds; and I’m coasting a bit.",neutral
1416,"I kept losing my train of thought. I subway musicians brightened the commute. As the day wound down, I steady rain hushed the street, and I’m calling it early.",slightly_negative
1417,"Nothing stood out much. Short version: better than yesterday. After that, video-chatted with relatives; later, back pain flared up again, and the hours slipped by.",neutral
1418,"I’m dragging my feet on everything — calendar reminders saved me; interview prep is dragging; and even simple tasks feel uphill.",sad
1419,"I’ll call this a small win. Short version: not great. As the day wound down, small argument over chores; later, tutorial cleared up a concept, and I’ll take the progress.",slightly_positive
1420,"Nothing stood out much. in a small way, slept better than usual. splurged a bit and now second‑guessing, so I just kept moving.",neutral
1421,"Everything feels dull and far away — took a long walk instead of rideshare; practice felt stale today; and I’m struggling to find any spark.",very_sad
1422,"Today sparkled from the start. I slept better than usual. After that, I submitted the assignment early, and I feel wildly grateful.",very_happy
1423,"I keep catching myself grinning for no reason; surprisingly, a sudden storm changed plans. On the way home, shared a silly story that broke the tension, and I feel wildly grateful.",very_happy
1424,"Feeling low and worn out. I went for a short run. After that, I splurged a bit and now second‑guessing, and I keep second‑guessing every step.",sad
1425,"Mildly frustrated. Short version: progress. By evening, a detour added twenty minutes; later, missed a call and feel bad, but I managed to push through.",slightly_negative
1426,"Hope feels out of reach right now. I left the list at home again. First thing this morning, I the connection felt like a marathon, and I’m struggling to find any spark.",very_sad
1427,"Loneliness crept in quietly. if I’m honest, professor's feedback was constructive. learned a new chord progression, and I miss how easy things used to feel.",sad
1428,"My chest feels heavy today. Short version: better than yesterday. Later on, donated a bag of clothes; later, helped a sibling with homework, and I keep second‑guessing every step.",sad
1429,"My heart feels light and loud in the best way — the puzzle finally made sense; doctor's advice was reassuring; and I'm soaking it up.",very_happy
1430,"Better than I expected; unfortunately, rent cleared without issues. Later on, cleaned the kitchen top to bottom, nothing flashy, just steady steps.",slightly_positive
1431,"Loneliness crept in quietly — lab report is due tomorrow; the seat was wobbly and annoying; and even simple tasks feel uphill.",sad
1432,"I kept losing my train of thought. for once, campus library was peaceful. the seat was wobbly and annoying, so I took more breaks than usual.",slightly_negative
1433,"Not bad at all. I merged a tricky pull request. Later on, I tutorial cleared up a concept, with room to grow tomorrow.",slightly_positive
1434,"Hope feels out of reach right now; somehow, sketched late into the night. As the day wound down, sunlight poured across the desk, and the future looks like fog on fog.",very_sad
1435,"I kept losing my train of thought; to be honest, sunlight poured across the desk. On the way home, left the list at home again, and I’m calling it early.",slightly_negative
1436,"Quietly optimistic here — budget app shows I'm on track; cool evening lifted my energy; nothing flashy, just steady steps.",slightly_positive
1437,"I'm pleasantly surprised by the day. I I skipped lunch and felt off. By evening, I budget app shows I'm on track, and the pace felt just right.",happy
1438,"I woke up empty and stayed that way; for what it’s worth, cooked a simple, decent meal. First thing this morning, the build succeeded on first try, and I’m moving like I’m underwater.",very_sad
1439,"My chest feels heavy today; thankfully, recorded a small win in my journal. Later on, organized the closet a bit, and I miss how easy things used to feel.",sad
1440,"Pretty decent flow today. surprisingly, sticky heat lingered all day. the puzzle finally made sense, which feels good enough for now.",slightly_positive
1441,"Pretty decent flow today; unfortunately, the puzzle finally made sense. Meanwhile, cleaned the kitchen top to bottom, and I’ll take the progress.",slightly_positive
1442,"I'm pleasantly surprised by the day. in a small way, cooked a simple, decent meal. rent cleared without issues, and I’m looking forward to tomorrow.",happy
1443,"Everything feels dull and far away — left the list at home again; the lecture clicked for once; and I’m tired down to the bones.",very_sad
1444,"My heart feels light and loud in the best way — got a warm message this morning; read a chapter that pulled me in; and I feel wildly grateful.",very_happy
1445,"Feeling grounded and content. I cleaned the kitchen top to bottom. As the day wound down, I lab report is due tomorrow, and I’m ending on a high note.",happy
1446,"I’m overwhelmed by a gray, sinking weight. I found a small discount at checkout. First thing this morning, I a bug fix finally shipped, and it’s hard to believe this will lift.",very_sad
1447,"Not bad at all. somehow, helped a sibling with homework. a bug fix finally shipped, with room to grow tomorrow.",slightly_positive
1448,"Better than I expected. Short version: not great. Right after lunch, I kept mistyping commands; later, left the list at home again, and I’ll take the progress.",slightly_positive
1449,"Nothing stood out much. Short version: mixed feelings. On the way home, unexpected fee threw me off; later, sketched late into the night, and I’m coasting a bit.",neutral
1450,"A nice rhythm set in early. Short version: not great. Later on, I keep rereading the same page; later, we planned a weekend picnic, and I’m looking forward to tomorrow.",happy
1451,"Things went smoothly overall. I a sync error ate my changes. As the day wound down, I recorded a small win in my journal, and I’m proud of the effort.",happy
1452,"Mostly routine, start to finish. Short version: not great. First thing this morning, the seat was wobbly and annoying; later, budget app shows I'm on track, and the hours slipped by.",neutral
1453,"My heart feels light and loud in the best way — aced a quiz after cramming; got a warm message this morning; and the momentum is unreal.",very_happy
1454,"Not bad at all; for once, missed a bus by seconds. By evening, missed a call and feel bad, nothing flashy, just steady steps.",slightly_positive
1455,"My heart feels light and loud in the best way — forgot the one thing I needed; took a long walk instead of rideshare; and I feel wildly grateful.",very_happy
1456,"I can’t see the point of anything today. Short version: better than yesterday. After that, the build succeeded on first try; later, saved a little from this paycheck, and I’m tired down to the bones.",very_sad
1457,"Hope feels out of reach right now. Short version: progress. Later on, recorded a small win in my journal; later, wrapped up a sprint review, and I’m tired down to the bones.",very_sad
1458,"I’m overwhelmed by a gray, sinking weight; for what it’s worth, phone battery held up all day. After that, humid air made chores sluggish, and I’m tired down to the bones.",very_sad
1459,"Good vibes carried me along. for once, the window view calmed me down. the lecture clicked for once, and the pace felt just right.",happy
1460,"My chest feels heavy today. I wind rattled the windows. On the way home, I the window view calmed me down, and I can’t shake this fog yet.",sad
1461,"Pretty decent flow today. I cool evening lifted my energy. Before noon, I groceries cost more than expected, nothing flashy, just steady steps.",slightly_positive
1462,"Not bad at all. Short version: progress. Meanwhile, read a chapter that pulled me in; later, missed a question I knew, with room to grow tomorrow.",slightly_positive
1463,"Things went smoothly overall; in a small way, the build succeeded on first try. Meanwhile, the standup actually ended on time, and I’m ending on a high note.",happy
1464,"I keep catching myself grinning for no reason. I practice felt stale today. Later on, I sunlight poured across the desk, and the momentum is unreal.",very_happy
1465,"Pretty decent flow today. Short version: mixed feelings. After that, went for a short run; later, subway musicians brightened the commute, nothing flashy, just steady steps.",slightly_positive
1466,"A nice rhythm set in early. Short version: progress. Meanwhile, donated a bag of clothes; later, small argument over chores, and I can breathe a little easier.",happy
1467,"Good vibes carried me along. Short version: better than yesterday. After that, computer fans roared under load; later, professor's feedback was constructive, and I’m proud of the effort.",happy
1468,"I’m dragging my feet on everything. for once, worries about an older relative's health. lab report is due tomorrow, and even simple tasks feel uphill.",sad
1469,"A nice rhythm set in early — voice notes were oddly helpful; steady rain hushed the street; and I’m ending on a high note.",happy
1470,"Tired and easily distracted. unfortunately, worries about an older relative's health. back pain flared up again, but I managed to push through.",slightly_negative
1471,"I’m disappointed in myself. Short version: not great. As the day wound down, organized the closet a bit; later, the lecture clicked for once, and I keep second‑guessing every step.",sad
1472,"A bit off my game. surprisingly, computer fans roared under load. energy dipped mid‑afternoon, so I took more breaks than usual.",slightly_negative
1473,"Better than I expected — a sudden storm changed plans; laundry took less time than feared; even if a few things wobbled.",slightly_positive
1474,"Everything aligned better than I hoped. Short version: progress. Meanwhile, I kept mistyping commands; later, airport lines moved briskly, and I want to bottle this feeling.",very_happy
1475,"I kept losing my train of thought; for what it’s worth, meditation actually helped. On the way home, finals are creeping closer, but tomorrow is another shot.",slightly_negative
1476,"I woke up empty and stayed that way; unfortunately, wifi behaved all morning. As the day wound down, missed a deadline by a day, and it’s hard to believe this will lift.",very_sad
1477,"I can’t see the point of anything today. I the forecast was kinder than expected. Meanwhile, I phone battery held up all day, and I’m moving like I’m underwater.",very_sad
1478,"I'm pleasantly surprised by the day. I group project is chaotic. First thing this morning, I traffic thinned out for once, and I’m ending on a high note.",happy
1479,"Pretty decent flow today. I finally restocked basics. Meanwhile, I my workload feels lopsided, even if a few things wobbled.",slightly_positive
1480,"I’m disappointed in myself. I sketched late into the night. After that, I we planned a weekend picnic, and the day felt longer than it was.",sad
1481,"Better than I expected. I trash day came too early. By evening, I meditation actually helped, with room to grow tomorrow.",slightly_positive
1482,"Better than I expected. thankfully, budget app shows I'm on track. a sudden storm changed plans, which feels good enough for now.",slightly_positive
1483,"My heart feels light and loud in the best way; oddly, splurged a bit and now second‑guessing. Before noon, wrapped up a sprint review, and I feel wildly grateful.",very_happy
1484,"I can't stop smiling. I group project is chaotic. On the way home, I donated a bag of clothes, and I feel wildly grateful.",very_happy
1485,"Nothing stood out much; for once, unexpected fee threw me off. By evening, the forecast was kinder than expected, and I’m coasting a bit.",neutral
1486,"A nice rhythm set in early. Short version: progress. After that, lab report is due tomorrow; later, steady rain hushed the street, and the pace felt just right.",happy
1487,"Kind of a mixed bag; honestly, missed a bus by seconds. After that, laundry took less time than feared, and I’m fine with that.",neutral
1488,"Small annoyances piled up. Short version: progress. First thing this morning, submitted the assignment early; later, anxiety fluttered for no clear reason, so I took more breaks than usual.",slightly_negative
1489,"Feeling low and worn out — app update fixed a nagging bug; energy dipped mid‑afternoon; and I keep second‑guessing every step.",sad
1490,"Today sparkled from the start. I canceled a subscription I never used. Right after lunch, I worries about an older relative's health, and I'm soaking it up.",very_happy
1491,"Kind of a mixed bag; unfortunately, groceries cost more than expected. First thing this morning, app update fixed a nagging bug, and I kept it simple.",neutral
1492,"A nice rhythm set in early. I traffic thinned out for once. After that, I finals are creeping closer, and I’m proud of the effort.",happy
1493,"Mildly frustrated; in a small way, wifi behaved all morning. As the day wound down, baked bread that actually rose, so I took more breaks than usual.",slightly_negative
1494,"Feeling low and worn out; if I’m honest, cleaned the kitchen top to bottom. Before noon, missed a call and feel bad, and even simple tasks feel uphill.",sad
1495,"I woke up empty and stayed that way; if I’m honest, sticky heat lingered all day. Before noon, wrapped up a sprint review, and I’m tired down to the bones.",very_sad
1496,"Loneliness crept in quietly — laundry took less time than feared; wifi behaved all morning; and I keep second‑guessing every step.",sad
1497,"Tired and easily distracted. thankfully, donated a bag of clothes. humid air made chores sluggish, but tomorrow is another shot.",slightly_negative
1498,"Nothing stood out much. I the connection felt like a marathon. By evening, I got a warm message this morning, and I kept it simple.",neutral
1499,"Feeling low and worn out; thankfully, wind rattled the windows. After that, canceled a subscription I never used, and the day felt longer than it was.",sad
1500,"Mostly routine, start to finish. I subway musicians brightened the commute. On the way home, I humid air made chores sluggish, and I kept it simple.",neutral
1501,"Mostly routine, start to finish — a sudden storm changed plans; donated a bag of clothes; so I just kept moving.",neutral
1502,"I can’t see the point of anything today. I sketched late into the night. Before noon, I stood in a long line for returns, and it’s hard to believe this will lift.",very_sad
1503,"Feeling grounded and content — trash day came too early; energy dipped mid‑afternoon; and I’m looking forward to tomorrow.",happy
1504,"Mildly frustrated — went for a short run; cool evening lifted my energy; but tomorrow is another shot.",slightly_negative
1505,"Today sparkled from the start. in a small way, finally restocked basics. humid air made chores sluggish, and it feels like pure lift.",very_happy
1506,"Not bad at all — phone battery held up all day; cool evening lifted my energy; and I’ll take the progress.",slightly_positive
1507,"Today sparkled from the start. honestly, forgot the one thing I needed. felt lonely even in a full house, and I feel wildly grateful.",very_happy
1508,"I keep catching myself grinning for no reason; in a small way, I skipped lunch and felt off. Meanwhile, missed a call and feel bad, and the momentum is unreal.",very_happy
1509,"Good vibes carried me along — aced a quiz after cramming; finally restocked basics; and I’m proud of the effort.",happy
1510,"Feeling low and worn out. Short version: not great. On the way home, back pain flared up again; later, helped a sibling with homework, and I miss how easy things used to feel.",sad
1511,"Small annoyances piled up. I took a long walk instead of rideshare. After that, I practice felt stale today, but I managed to push through.",slightly_negative
1512,"I can’t see the point of anything today. Short version: not great. As the day wound down, a quiet dinner at home; later, the forecast was kinder than expected, and the future looks like fog on fog.",very_sad
1513,"My heart feels light and loud in the best way. to be honest, groceries cost more than expected. went for a short run, and I'm soaking it up.",very_happy
1514,"Everything feels dull and far away. Short version: better than yesterday. First thing this morning, the connection felt like a marathon; later, wind rattled the windows, and I’m tired down to the bones.",very_sad
1515,"I can’t see the point of anything today — video-chatted with relatives; the connection felt like a marathon; and I’m moving like I’m underwater.",very_sad
1516,"Nothing stood out much. I group project is chaotic. Later on, I felt lonely even in a full house, so I just kept moving.",neutral
1517,"A nice rhythm set in early. I baked bread that actually rose. Right after lunch, I canceled a subscription I never used, and the pace felt just right.",happy
1518,"Small annoyances piled up — my plants perked up; rent cleared without issues; but tomorrow is another shot.",slightly_negative
1519,"Small annoyances piled up — we planned a weekend picnic; presentation slides took longer than expected; though it’s nothing catastrophic.",slightly_negative
1520,"Good vibes carried me along. I presentation slides took longer than expected. Meanwhile, I found a small discount at checkout, and I’m proud of the effort.",happy
1521,"Quietly optimistic here. surprisingly, trash day came too early. wrapped up a sprint review, which feels good enough for now.",slightly_positive
1522,"Loneliness crept in quietly. unfortunately, a bright, crisp morning. presentation slides took longer than expected, and I miss how easy things used to feel.",sad
1523,"I'm pleasantly surprised by the day — wind rattled the windows; read a chapter that pulled me in; and I’m looking forward to tomorrow.",happy
1524,"Mildly frustrated; in a small way, found a small discount at checkout. Later on, tutorial cleared up a concept, though it’s nothing catastrophic.",slightly_negative
1525,"Pretty decent flow today. Short version: still here. After that, we planned a weekend picnic; later, the lecture clicked for once, nothing flashy, just steady steps.",slightly_positive
1526,"I'm pleasantly surprised by the day. Short version: not great. After that, aced a quiz after cramming; later, finally restocked basics, and I’m looking forward to tomorrow.",happy
1527,"Everything feels dull and far away. I recorded a small win in my journal. Later on, I the lecture clicked for once, and it’s hard to believe this will lift.",very_sad
1528,"I’m overwhelmed by a gray, sinking weight. to be honest, aced a quiz after cramming. forgot the one thing I needed, and it’s hard to believe this will lift.",very_sad
1529,"My chest feels heavy today. for once, my plants perked up. voice notes were oddly helpful, and the day felt longer than it was.",sad
1530,"I keep catching myself grinning for no reason. I found a small discount at checkout. After that, I my manager praised the draft, and I'm soaking it up.",very_happy
1531,"Today sparkled from the start. I rent cleared without issues. Before noon, I felt lonely even in a full house, and I'm soaking it up.",very_happy
1532,"I can’t see the point of anything today. Short version: mixed feelings. Right after lunch, half‑finished a watercolor; later, doctor's advice was reassuring, and I’m moving like I’m underwater.",very_sad
1533,"Today sparkled from the start — meditation actually helped; gray skies matched my mood; and the momentum is unreal.",very_happy
1534,"My heart feels light and loud in the best way; to be honest, video-chatted with relatives. Right after lunch, the lecture clicked for once, and it feels like pure lift.",very_happy
1535,"I kept losing my train of thought. Short version: mixed feelings. Later on, missed a bus by seconds; later, interview prep is dragging, though it’s nothing catastrophic.",slightly_negative
1536,"Quietly optimistic here — read a chapter that pulled me in; the connection felt like a marathon; which feels good enough for now.",slightly_positive
1537,"Kind of a mixed bag. unfortunately, app update fixed a nagging bug. anxiety fluttered for no clear reason, and I’m fine with that.",neutral
1538,"Tired and easily distracted. for what it’s worth, airport lines moved briskly. the puzzle finally made sense, so I took more breaks than usual.",slightly_negative
1539,"My heart feels light and loud in the best way; honestly, wind rattled the windows. On the way home, interview prep is dragging, and I feel wildly grateful.",very_happy
1540,"I’m overwhelmed by a gray, sinking weight. if I’m honest, wind rattled the windows. felt lonely even in a full house, and it’s hard to believe this will lift.",very_sad
1541,"A bit off my game. I a detour added twenty minutes. Right after lunch, I missed a call and feel bad, but I managed to push through.",slightly_negative
1542,"A bit off my game. for once, unexpected fee threw me off. app update fixed a nagging bug, so I took more breaks than usual.",slightly_negative
1543,"Quietly optimistic here. if I’m honest, cool evening lifted my energy. video-chatted with relatives, even if a few things wobbled.",slightly_positive
1544,"I’m dragging my feet on everything. surprisingly, stood in a long line for returns. saved a little from this paycheck, and the day felt longer than it was.",sad
1545,"Nothing stood out much. Short version: progress. Right after lunch, couldn't focus during the planning call; later, paid a bill before it was due, and I’m coasting a bit.",neutral
1546,"Hope feels out of reach right now. Short version: not great. On the way home, organized the closet a bit; later, helped a sibling with homework, and I’m moving like I’m underwater.",very_sad
1547,"I woke up empty and stayed that way. I missed a question I knew. On the way home, I interview prep is dragging, and it’s hard to believe this will lift.",very_sad
1548,"Quietly optimistic here. I practice felt stale today. Before noon, I subway musicians brightened the commute, with room to grow tomorrow.",slightly_positive
1549,"Pretty decent flow today; somehow, recorded a small win in my journal. First thing this morning, anxiety fluttered for no clear reason, and I’ll take the progress.",slightly_positive
1550,"Things went smoothly overall. Short version: not great. Later on, baked bread that actually rose; later, lost a tab group and sighed, and I’m looking forward to tomorrow.",happy
1551,"Loneliness crept in quietly — missed a bus by seconds; found a small discount at checkout; and even simple tasks feel uphill.",sad
1552,"Not bad at all. Short version: still here. First thing this morning, a bug fix finally shipped; later, traffic thinned out for once, nothing flashy, just steady steps.",slightly_positive
1553,"I keep catching myself grinning for no reason. Short version: better than yesterday. Before noon, found a small discount at checkout; later, read a chapter that pulled me in, and the momentum is unreal.",very_happy
1554,"My chest feels heavy today. I study session ran too late. By evening, I budget app shows I'm on track, and I keep second‑guessing every step.",sad
1555,"Nothing stood out much; for what it’s worth, sunlight poured across the desk. By evening, found a small deal on essentials, and I kept it simple.",neutral
