case_id,message,mood
0463,"My chest feels heavy today. Short version: better than yesterday. By evening, saved a little from this paycheck; later, a quiet dinner at home, and even simple tasks feel uphill.",sad
0464,"My chest feels heavy today. unfortunately, trash day came too early. back pain flared up again, and I can’t shake this fog yet.",sad
0465,"Small annoyances piled up. honestly, felt lonely even in a full house. voice notes were oddly helpful, and I’m calling it early.",slightly_negative
0466,"It was an ordinary blur. to be honest, we planned a weekend picnic. left the list at home again, so I just kept moving.",neutral
0467,"My chest feels heavy today — back pain flared up again; laundry took less time than feared; and the day felt longer than it was.",sad
0468,"I can't stop smiling. honestly, airport lines moved briskly. doctor's advice was reassuring, and the momentum is unreal.",very_happy
0469,"I kept losing my train of thought; somehow, organized the closet a bit. First thing this morning, wifi behaved all morning, but I managed to push through.",slightly_negative
0470,"Not bad at all; honestly, cooked a simple, decent meal. As the day wound down, lost a tab group and sighed, with room to grow tomorrow.",slightly_positive
0471,"Quietly optimistic here. somehow, I skipped lunch and felt off. splurged a bit and now second‑guessing, nothing flashy, just steady steps.",slightly_positive
0472,"Feeling grounded and content; if I’m honest, rent cleared without issues. As the day wound down, my manager praised the draft, and the pace felt just right.",happy
0473,"Mostly routine, start to finish. I small argument over chores. Meanwhile, I lost a tab group and sighed, and I’m coasting a bit.",neutral
0474,"Nothing stood out much; oddly, the connection felt like a marathon. After that, woke up with a light headache, and I’m coasting a bit.",neutral
0475,"I'm pleasantly surprised by the day. Short version: better than yesterday. Right after lunch, study session ran too late; later, donated a bag of clothes, and I’m ending on a high note.",happy
0476,"It was an ordinary blur. I got a warm message this morning. After that, I a sudden storm changed plans, and I kept it simple.",neutral
0477,"Nothing stood out much. I video-chatted with relatives. By evening, I forgot the one thing I needed, and I’m coasting a bit.",neutral
0478,"Average day, average energy. to be honest, lab report is due tomorrow. video-chatted with relatives, and I’m coasting a bit.",neutral
0479,"I woke up empty and stayed that way. surprisingly, the train arrived right as I reached the platform. I kept mistyping commands, and it’s hard to believe this will lift.",very_sad
0480,"I’m dragging my feet on everything — steady rain hushed the street; the seat was wobbly and annoying; and I can’t shake this fog yet.",sad
0481,"Pretty decent flow today; to be honest, left the list at home again. On the way home, wifi behaved all morning, and I’ll take the progress.",slightly_positive
0482,"Nothing stood out much; if I’m honest, felt lonely even in a full house. Meanwhile, merged a tricky pull request, and I’m coasting a bit.",neutral
0483,"A nice rhythm set in early. I wind rattled the windows. As the day wound down, I helped a sibling with homework, and I’m looking forward to tomorrow.",happy
0484,"Small annoyances piled up; unfortunately, the train arrived right as I reached the platform. Right after lunch, baked bread that actually rose, though it’s nothing catastrophic.",slightly_negative
0485,"Loneliness crept in quietly — steady rain hushed the street; computer fans roared under load; and even simple tasks feel uphill.",sad
0486,"Today sparkled from the start. Short version: better than yesterday. Later on, calendar reminders saved me; later, humid air made chores sluggish, and the momentum is unreal.",very_happy
0487,"Nothing stood out much — study session ran too late; the seat was wobbly and annoying; so I just kept moving.",neutral
0488,"Average day, average energy. in a small way, phone battery held up all day. recorded a small win in my journal, so I just kept moving.",neutral
0489,"Not bad at all; to be honest, helped a sibling with homework. First thing this morning, back pain flared up again, even if a few things wobbled.",slightly_positive
0490,"Hope feels out of reach right now; in a small way, doctor's advice was reassuring. Before noon, sunlight poured across the desk, and I’m moving like I’m underwater.",very_sad
0491,"I'm pleasantly surprised by the day — meditation actually helped; groceries cost more than expected; and I’m proud of the effort.",happy
0492,"I’m disappointed in myself. I couldn't focus during the planning call. Meanwhile, I I keep rereading the same page, and the day felt longer than it was.",sad
0493,"I woke up empty and stayed that way. oddly, energy dipped mid‑afternoon. the puzzle finally made sense, and I’m struggling to find any spark.",very_sad
0494,"Loneliness crept in quietly — got a warm message this morning; the window view calmed me down; and the day felt longer than it was.",sad
0495,"Not bad at all — organized the closet a bit; tinkered with a recipe and it flopped; and I’ll take the progress.",slightly_positive
0496,"Everything aligned better than I hoped. I professor's feedback was constructive. As the day wound down, I video-chatted with relatives, and I want to bottle this feeling.",very_happy
0497,"Good vibes carried me along — stood in a long line for returns; sticky heat lingered all day; and I’m proud of the effort.",happy
0498,"Quietly optimistic here. Short version: mixed feelings. Before noon, cool evening lifted my energy; later, lab report is due tomorrow, which feels good enough for now.",slightly_positive
0499,"Things went smoothly overall; somehow, missed a call and feel bad. As the day wound down, aced a quiz after cramming, and I’m ending on a high note.",happy
0500,"Small annoyances piled up — took a long walk instead of rideshare; app update fixed a nagging bug; so I took more breaks than usual.",slightly_negative
0501,"I’m overwhelmed by a gray, sinking weight. to be honest, got a warm message this morning. tutorial cleared up a concept, and it’s hard to believe this will lift.",very_sad
0502,"It was an ordinary blur. if I’m honest, wifi behaved all morning. professor's feedback was constructive, and the hours slipped by.",neutral
0503,"Quietly optimistic here. I learned a neat trick in the editor. By evening, I tutorial cleared up a concept, even if a few things wobbled.",slightly_positive
0504,"Quietly optimistic here; unfortunately, my plants perked up. First thing this morning, meditation actually helped, with room to grow tomorrow.",slightly_positive
0505,"It was an ordinary blur. Short version: progress. As the day wound down, paid a bill before it was due; later, helped a sibling with homework, and I’m fine with that.",neutral
0506,"Small annoyances piled up. Short version: still here. By evening, energy dipped mid‑afternoon; later, calendar reminders saved me, though it’s nothing catastrophic.",slightly_negative
0507,"Hope feels out of reach right now. I helped a sibling with homework. Meanwhile, I finals are creeping closer, and I’m tired down to the bones.",very_sad
0508,"Not bad at all. to be honest, couldn't focus during the planning call. the train arrived right as I reached the platform, which feels good enough for now.",slightly_positive
0509,"My heart feels light and loud in the best way — sticky heat lingered all day; felt lonely even in a full house; and the momentum is unreal.",very_happy
0510,"Average day, average energy; if I’m honest, woke up with a light headache. First thing this morning, voice notes were oddly helpful, and I kept it simple.",neutral
0511,"Things went smoothly overall — the connection felt like a marathon; found a small discount at checkout; and I can breathe a little easier.",happy
0512,"Tired and easily distracted. to be honest, gray skies matched my mood. missed a call and feel bad, so I took more breaks than usual.",slightly_negative
0513,"Kind of a mixed bag. Short version: progress. After that, missed a question I knew; later, the puzzle finally made sense, and I’m coasting a bit.",neutral
0514,"Feeling low and worn out. in a small way, gray skies matched my mood. campus library was peaceful, and I miss how easy things used to feel.",sad
0515,"I’m overwhelmed by a gray, sinking weight. for what it’s worth, left the list at home again. sticky heat lingered all day, and I’m tired down to the bones.",very_sad
0516,"I woke up empty and stayed that way. Short version: still here. On the way home, lab report is due tomorrow; later, recorded a small win in my journal, and the future looks like fog on fog.",very_sad
0517,"Good vibes carried me along — felt lonely even in a full house; missed a question I knew; and I’m looking forward to tomorrow.",happy
0518,"Everything aligned better than I hoped. Short version: not great. Later on, voice notes were oddly helpful; later, group project is chaotic, and I want to bottle this feeling.",very_happy
0519,"I’m overwhelmed by a gray, sinking weight. I learned a new chord progression. Meanwhile, I missed a bus by seconds, and it’s hard to believe this will lift.",very_sad
0520,"Tired and easily distracted. I got a warm message this morning. First thing this morning, I a detour added twenty minutes, but tomorrow is another shot.",slightly_negative
0521,"Quietly optimistic here. Short version: progress. Later on, meditation actually helped; later, recorded a small win in my journal, which feels good enough for now.",slightly_positive
0522,"Small annoyances piled up; unfortunately, forgot the one thing I needed. As the day wound down, phone battery held up all day, but I managed to push through.",slightly_negative
0523,"I'm pleasantly surprised by the day. Short version: not great. Right after lunch, interview prep is dragging; later, a sync error ate my changes, and I’m ending on a high note.",happy
0524,"Mostly routine, start to finish. surprisingly, sketched late into the night. a sudden storm changed plans, and the hours slipped by.",neutral
0525,"Nothing stood out much. I got a warm message this morning. By evening, I doctor's advice was reassuring, so I just kept moving.",neutral
0526,"It was an ordinary blur. I a quiet dinner at home. Right after lunch, I couldn't focus during the planning call, and I kept it simple.",neutral
0527,"Tired and easily distracted. honestly, tutorial cleared up a concept. shared a silly story that broke the tension, but tomorrow is another shot.",slightly_negative
0528,"Loneliness crept in quietly. surprisingly, calendar reminders saved me. cool evening lifted my energy, and I miss how easy things used to feel.",sad
0529,"I’m overwhelmed by a gray, sinking weight. Short version: better than yesterday. Right after lunch, trash day came too early; later, the meeting could've been an email, and I’m tired down to the bones.",very_sad
0530,"Tired and easily distracted; if I’m honest, learned a new chord progression. First thing this morning, merged a tricky pull request, though it’s nothing catastrophic.",slightly_negative
0531,"I’m dragging my feet on everything. I helped a sibling with homework. Later on, I voice notes were oddly helpful, and I can’t shake this fog yet.",sad
0532,"Quietly optimistic here. Short version: progress. On the way home, subway musicians brightened the commute; later, finals are creeping closer, with room to grow tomorrow.",slightly_positive
0533,"I keep catching myself grinning for no reason — subway musicians brightened the commute; donated a bag of clothes; and it feels like pure lift.",very_happy
0534,"Quietly optimistic here. thankfully, budget app shows I'm on track. felt lonely even in a full house, with room to grow tomorrow.",slightly_positive
0535,"Small annoyances piled up. to be honest, trash day came too early. video-chatted with relatives, but tomorrow is another shot.",slightly_negative
0536,"I’m disappointed in myself — campus library was peaceful; a quiet dinner at home; and I miss how easy things used to feel.",sad
0537,"Kind of a mixed bag — groceries cost more than expected; merged a tricky pull request; and the hours slipped by.",neutral
0538,"Today sparkled from the start; to be honest, we planned a weekend picnic. On the way home, found a small discount at checkout, and the momentum is unreal.",very_happy
0539,"Feeling grounded and content. I worries about an older relative's health. First thing this morning, I forgot the one thing I needed, and I can breathe a little easier.",happy
0540,"Not bad at all. for what it’s worth, slept better than usual. practice felt stale today, even if a few things wobbled.",slightly_positive
0541,"I’m overwhelmed by a gray, sinking weight. oddly, the connection felt like a marathon. rent cleared without issues, and the future looks like fog on fog.",very_sad
0542,"It was an ordinary blur — rent cleared without issues; shared a silly story that broke the tension; and I’m coasting a bit.",neutral
0543,"Everything aligned better than I hoped — a sync error ate my changes; learned a neat trick in the editor; and I want to bottle this feeling.",very_happy
0544,"I can’t see the point of anything today. Short version: still here. Before noon, groceries cost more than expected; later, found a small deal on essentials, and the future looks like fog on fog.",very_sad
0545,"I’ll call this a small win; oddly, phone battery held up all day. Meanwhile, read a chapter that pulled me in, even if a few things wobbled.",slightly_positive
0546,"It was an ordinary blur — the standup actually ended on time; the forecast was kinder than expected; so I just kept moving.",neutral
0547,"I’ll call this a small win. Short version: progress. Before noon, budget app shows I'm on track; later, slept better than usual, even if a few things wobbled.",slightly_positive
0548,"Tired and easily distracted. I finals are creeping closer. Later on, I stood in a long line for returns, but tomorrow is another shot.",slightly_negative
0549,"Better than I expected — found a small discount at checkout; laundry took less time than feared; nothing flashy, just steady steps.",slightly_positive
0550,"I woke up empty and stayed that way — helped a sibling with homework; aced a quiz after cramming; and the future looks like fog on fog.",very_sad
0551,"I woke up empty and stayed that way. I found a small discount at checkout. Right after lunch, I a quiet dinner at home, and it’s hard to believe this will lift.",very_sad
0552,"My heart feels light and loud in the best way. for once, took a long walk instead of rideshare. campus library was peaceful, and I feel wildly grateful.",very_happy
0553,"Mildly frustrated; thankfully, budget app shows I'm on track. First thing this morning, the lecture clicked for once, but tomorrow is another shot.",slightly_negative
0554,"Loneliness crept in quietly. for what it’s worth, the train arrived right as I reached the platform. video-chatted with relatives, and I miss how easy things used to feel.",sad
0555,"Better than I expected; honestly, organized the closet a bit. Right after lunch, presentation slides took longer than expected, which feels good enough for now.",slightly_positive
0556,"Tired and easily distracted — wifi behaved all morning; doctor's advice was reassuring; but I managed to push through.",slightly_negative
0557,"I can't stop smiling; in a small way, sketched late into the night. On the way home, budget app shows I'm on track, and it feels like pure lift.",very_happy
0558,"I kept losing my train of thought — traffic thinned out for once; paid a bill before it was due; but I managed to push through.",slightly_negative
0559,"Mildly frustrated; surprisingly, gray skies matched my mood. After that, missed a question I knew, so I took more breaks than usual.",slightly_negative
0560,"I woke up empty and stayed that way — anxiety fluttered for no clear reason; a bug fix finally shipped; and the future looks like fog on fog.",very_sad
0561,"Everything feels dull and far away; to be honest, the connection felt like a marathon. On the way home, wifi behaved all morning, and I’m moving like I’m underwater.",very_sad
0562,"I can’t see the point of anything today. I humid air made chores sluggish. As the day wound down, I tutorial cleared up a concept, and the future looks like fog on fog.",very_sad
0563,"My chest feels heavy today. oddly, laundry took less time than feared. slept better than usual, and the day felt longer than it was.",sad
0564,"My chest feels heavy today — left the list at home again; presentation slides took longer than expected; and I can’t shake this fog yet.",sad
0565,"I keep catching myself grinning for no reason. if I’m honest, finals are creeping closer. took a long walk instead of rideshare, and I'm soaking it up.",very_happy
0566,"Tired and easily distracted — laundry took less time than feared; back pain flared up again; though it’s nothing catastrophic.",slightly_negative
0567,"Pretty decent flow today — group project is chaotic; the build succeeded on first try; even if a few things wobbled.",slightly_positive
0568,"Tired and easily distracted. I professor's feedback was constructive. As the day wound down, I stood in a long line for returns, and I’m calling it early.",slightly_negative
0569,"Today sparkled from the start. I the seat was wobbly and annoying. Right after lunch, I slept better than usual, and I'm soaking it up.",very_happy
0570,"Not bad at all. if I’m honest, the standup actually ended on time. the train arrived right as I reached the platform, and I’ll take the progress.",slightly_positive
0571,"Small annoyances piled up. I traffic thinned out for once. Right after lunch, I small argument over chores, but tomorrow is another shot.",slightly_negative
0572,"Feeling grounded and content — felt lonely even in a full house; my manager praised the draft; and I’m looking forward to tomorrow.",happy
0573,"I’m overwhelmed by a gray, sinking weight. Short version: mixed feelings. Later on, the forecast was kinder than expected; later, a bug fix finally shipped, and I’m struggling to find any spark.",very_sad
0574,"Things went smoothly overall; to be honest, app update fixed a nagging bug. Before noon, donated a bag of clothes, and I’m proud of the effort.",happy
0575,"Today sparkled from the start — worries about an older relative's health; took a long walk instead of rideshare; and I'm soaking it up.",very_happy
0576,"I’m dragging my feet on everything; to be honest, meditation actually helped. Later on, gray skies matched my mood, and the day felt longer than it was.",sad
0577,"Better than I expected. I phone battery held up all day. Later on, I video-chatted with relatives, with room to grow tomorrow.",slightly_positive
0578,"Small annoyances piled up. I airport lines moved briskly. On the way home, I my plants perked up, and I’m calling it early.",slightly_negative
0579,"Pretty decent flow today. surprisingly, study session ran too late. doctor's advice was reassuring, which feels good enough for now.",slightly_positive
0580,"Today sparkled from the start. I finally restocked basics. First thing this morning, I airport lines moved briskly, and I feel wildly grateful.",very_happy
0581,"Things went smoothly overall — wind rattled the windows; the puzzle finally made sense; and I’m proud of the effort.",happy
0582,"I’m disappointed in myself. if I’m honest, felt lonely even in a full house. wrapped up a sprint review, and even simple tasks feel uphill.",sad
0583,"Quietly optimistic here. Short version: better than yesterday. After that, gray skies matched my mood; later, we planned a weekend picnic, with room to grow tomorrow.",slightly_positive
0584,"My heart feels light and loud in the best way. for once, doctor's advice was reassuring. campus library was peaceful, and I feel wildly grateful.",very_happy
0585,"A bit off my game. Short version: still here. Right after lunch, splurged a bit and now second‑guessing; later, presentation slides took longer than expected, and I’m calling it early.",slightly_negative
0586,"I woke up empty and stayed that way. Short version: progress. First thing this morning, trash day came too early; later, video-chatted with relatives, and I’m struggling to find any spark.",very_sad
0587,"Everything feels dull and far away; somehow, a sudden storm changed plans. Before noon, voice notes were oddly helpful, and the future looks like fog on fog.",very_sad
0588,"My chest feels heavy today; thankfully, lost a tab group and sighed. Before noon, a bug fix finally shipped, and I miss how easy things used to feel.",sad
0589,"Kind of a mixed bag. for once, couldn't focus during the planning call. a detour added twenty minutes, so I just kept moving.",neutral
0590,"I'm pleasantly surprised by the day; oddly, airport lines moved briskly. Meanwhile, small argument over chores, and the pace felt just right.",happy
0591,"Nothing stood out much. Short version: still here. As the day wound down, the forecast was kinder than expected; later, learned a new chord progression, so I just kept moving.",neutral
0592,"I’m dragging my feet on everything. to be honest, study session ran too late. learned a new chord progression, and I miss how easy things used to feel.",sad
0593,"I'm pleasantly surprised by the day; for what it’s worth, recorded a small win in my journal. As the day wound down, the train arrived right as I reached the platform, and I’m proud of the effort.",happy
0594,"Pretty decent flow today. Short version: still here. First thing this morning, phone battery held up all day; later, energy dipped mid‑afternoon, with room to grow tomorrow.",slightly_positive
0595,"I’ll call this a small win; thankfully, energy dipped mid‑afternoon. Meanwhile, practice felt stale today, which feels good enough for now.",slightly_positive
0596,"I kept losing my train of thought. Short version: better than yesterday. First thing this morning, the puzzle finally made sense; later, donated a bag of clothes, but tomorrow is another shot.",slightly_negative
0597,"Feeling low and worn out; somehow, still nervous about rising costs. Later on, the window view calmed me down, and even simple tasks feel uphill.",sad
0598,"It was an ordinary blur. I a bright, crisp morning. Later on, I a quiet dinner at home, and I kept it simple.",neutral
0599,"I can't stop smiling. I traffic thinned out for once. As the day wound down, I got a warm message this morning, and it feels like pure lift.",very_happy
0600,"I can't stop smiling; surprisingly, airport lines moved briskly. Later on, the puzzle finally made sense, and it feels like pure lift.",very_happy
0601,"I can’t see the point of anything today. oddly, energy dipped mid‑afternoon. lost a tab group and sighed, and I’m moving like I’m underwater.",very_sad
0602,"Loneliness crept in quietly — organized the closet a bit; voice notes were oddly helpful; and I miss how easy things used to feel.",sad
0603,"Nothing stood out much — we planned a weekend picnic; found a small discount at checkout; and I’m coasting a bit.",neutral
0604,"Pretty decent flow today. I paid a bill before it was due. After that, I the seat was wobbly and annoying, with room to grow tomorrow.",slightly_positive
0605,"Good vibes carried me along. for once, we planned a weekend picnic. laundry took less time than feared, and I’m proud of the effort.",happy
0606,"I can’t see the point of anything today — paid a bill before it was due; my plants perked up; and I’m struggling to find any spark.",very_sad
0607,"Today sparkled from the start; thankfully, worries about an older relative's health. Later on, tinkered with a recipe and it flopped, and the momentum is unreal.",very_happy
0608,"I’m disappointed in myself. Short version: mixed feelings. As the day wound down, wind rattled the windows; later, the connection felt like a marathon, and even simple tasks feel uphill.",sad
0609,"Pretty decent flow today; somehow, unexpected fee threw me off. On the way home, the seat was wobbly and annoying, with room to grow tomorrow.",slightly_positive
0610,"Average day, average energy. thankfully, took a long walk instead of rideshare. couldn't focus during the planning call, and I’m fine with that.",neutral
0611,"Good vibes carried me along. Short version: better than yesterday. Before noon, donated a bag of clothes; later, energy dipped mid‑afternoon, and I’m proud of the effort.",happy
0612,"Not bad at all. Short version: not great. Later on, back pain flared up again; later, budget app shows I'm on track, with room to grow tomorrow.",slightly_positive
0613,"I’m dragging my feet on everything. to be honest, energy dipped mid‑afternoon. the seat was wobbly and annoying, and I keep second‑guessing every step.",sad
0614,"I’m disappointed in myself — missed a call and feel bad; a sudden storm changed plans; and I can’t shake this fog yet.",sad
0615,"Pretty decent flow today — rent cleared without issues; missed a bus by seconds; which feels good enough for now.",slightly_positive
0616,"Average day, average energy. I shared a silly story that broke the tension. After that, I wind rattled the windows, and the hours slipped by.",neutral
0617,"Feeling low and worn out; honestly, rent cleared without issues. Later on, the window view calmed me down, and I keep second‑guessing every step.",sad
0618,"I kept losing my train of thought. I a sudden storm changed plans. After that, I paid a bill before it was due, so I took more breaks than usual.",slightly_negative
